{"$comment":"Owning contract: contracts/decision-packet.schema.json per ROADMAP.md §0.4, Paper IV §6.6. Decision packet — the single artifact of an approval moment (glossary: Decision packet, RD-4). DRAFT 0.1 — built 2026-10-21 on HgX's order; awaiting ratification. Normative on ratification only.","$id":"https://jarvis-estate/contracts/decision-packet.schema.json","$schema":"http://json-schema.org/draft-07/schema#","additionalProperties":false,"properties":{"auth_method":{"description":"Authentication method used (glossary: Approval decision)","type":"string"},"claimed_outcome":{"description":"Outcome the decision claims for the work item. INVARIANT (Paper III): a decision packet cannot claim 'completed' if required tests failed or a critical gap remains. Enforced by verification logic; declared here because JSON Schema cannot cross-reference the evidence packet","enum":["completed","blocked","failed","cancelled"],"type":"string"},"decision":{"description":"The operator's recorded verdict (glossary: Approval decision)","enum":["granted","denied"],"type":"string"},"device_session_id":{"description":"Authorised device session (PO-8)","type":"string"},"intent_digest":{"description":"Digest echo: the digest AS PRESENTED to the operator. Server validates DigestOf(intent) = tap_digest = this value before recording (PO-3, INV-A5)","pattern":"^[0-9a-f]{64}$","type":"string"},"intent_id":{"description":"Intent this decision answers","type":"string"},"server_recorded_at":{"description":"Server-recorded timestamp. Together with the digest echo this is the definition of 'authoritative' (INV-A5): recorded by the server, digest-matched, timestamped","format":"date-time","type":"string"},"timestamp":{"description":"Client-observed tap time","format":"date-time","type":"string"}},"required":["intent_id","intent_digest","decision","device_session_id","timestamp","auth_method","server_recorded_at"],"title":"DecisionPacket","type":"object","version":"0.1-draft"}